{
  "checkpoint_result": {
    "build_pack_id": "json-health-checker-degraded-connectivity-build-pack-v1",
    "completed_task_id": "run_build_pack_validation",
    "feedback_memory_path": "/home/orchadmin/project-pack-factory/build-packs/json-health-checker-degraded-connectivity-build-pack-v1/.pack-state/agent-memory/autonomy-feedback-json-health-checker-degraded-connectivity-build-pack-v1-degraded-connectivity-checkpoint-v1.json",
    "next_active_task_id": "run_inherited_benchmarks",
    "pointer_result": {
      "build_pack_id": "json-health-checker-degraded-connectivity-build-pack-v1",
      "pointer_path": "/home/orchadmin/project-pack-factory/build-packs/json-health-checker-degraded-connectivity-build-pack-v1/.pack-state/agent-memory/latest-memory.json",
      "selected_memory_path": "/home/orchadmin/project-pack-factory/build-packs/json-health-checker-degraded-connectivity-build-pack-v1/.pack-state/agent-memory/autonomy-feedback-json-health-checker-degraded-connectivity-build-pack-v1-degraded-connectivity-checkpoint-v1.json",
      "selected_run_id": "json-health-checker-degraded-connectivity-build-pack-v1-degraded-connectivity-checkpoint-v1",
      "status": "activated"
    },
    "run_id": "json-health-checker-degraded-connectivity-build-pack-v1-degraded-connectivity-checkpoint-v1",
    "run_summary_path": "/home/orchadmin/project-pack-factory/build-packs/json-health-checker-degraded-connectivity-build-pack-v1/.pack-state/autonomy-runs/json-health-checker-degraded-connectivity-build-pack-v1-degraded-connectivity-checkpoint-v1/run-summary.json",
    "status": "completed"
  },
  "delayed_import_result": {
    "build_pack_id": "json-health-checker-degraded-connectivity-build-pack-v1",
    "build_pack_root": "build-packs/json-health-checker-degraded-connectivity-build-pack-v1",
    "copied_artifact_paths": [
      "external-runtime-evidence/bundle.json",
      "external-runtime-evidence/artifacts/agent-memory/autonomy-feedback-json-health-checker-degraded-connectivity-build-pack-v1-degraded-connectivity-remote-run-v1.json",
      "external-runtime-evidence/artifacts/loop-events.jsonl",
      "external-runtime-evidence/artifacts/run-summary.json"
    ],
    "generated_at": "2026-03-25T18:29:12Z",
    "import_id": "import-external-runtime-evidence-20260325t182912z",
    "import_report_path": "/home/orchadmin/project-pack-factory/build-packs/json-health-checker-degraded-connectivity-build-pack-v1/eval/history/import-external-runtime-evidence-20260325t182912z/import-report.json",
    "memory_intake": {
      "block_summary": null,
      "latest_pointer_path": ".pack-state/agent-memory/latest-memory.json",
      "promoted_memory_path": ".pack-state/agent-memory/autonomy-feedback-json-health-checker-degraded-connectivity-build-pack-v1-degraded-connectivity-remote-run-v1.json",
      "selected_memory_id": "autonomy-feedback-json-health-checker-degraded-connectivity-build-pack-v1-degraded-connectivity-remote-run-v1",
      "selected_memory_sha256": "d1c58fd2be5d92c5aa5580d439fbeab167dadbf4aca6a4ebb0de47d106d8205f",
      "selected_run_id": "json-health-checker-degraded-connectivity-build-pack-v1-degraded-connectivity-remote-run-v1",
      "source_bundle_path": "external-runtime-evidence/artifacts/agent-memory/autonomy-feedback-json-health-checker-degraded-connectivity-build-pack-v1-degraded-connectivity-remote-run-v1.json",
      "status": "promoted_only"
    },
    "status": "completed"
  },
  "exercise_id": "degraded-connectivity-autonomy-exercise-json-health-checker-degraded-connectivity-build-pack-v1-20260325t182851z",
  "final_state": {
    "latest_memory": {
      "pack_id": "json-health-checker-degraded-connectivity-build-pack-v1",
      "schema_version": "autonomy-feedback-memory-pointer/v1",
      "selected_generated_at": "2026-03-25T18:29:16Z",
      "selected_memory_id": "autonomy-feedback-json-health-checker-degraded-connectivity-build-pack-v1-continuity-run-v1",
      "selected_memory_path": ".pack-state/agent-memory/autonomy-feedback-json-health-checker-degraded-connectivity-build-pack-v1-continuity-run-v1.json",
      "selected_memory_sha256": "ea3d4ee8edce0a8a99ae32f9af47a5223e4ee1ce8140d381b02742659605925c",
      "selected_run_id": "json-health-checker-degraded-connectivity-build-pack-v1-continuity-run-v1",
      "source_artifact_path": "external-runtime-evidence/artifacts/agent-memory/autonomy-feedback-json-health-checker-degraded-connectivity-build-pack-v1-continuity-run-v1.json",
      "source_import_id": "import-external-runtime-evidence-20260325t182918z",
      "source_import_report_path": "eval/history/import-external-runtime-evidence-20260325t182918z/import-report.json",
      "source_kind": "imported_external_runtime_evidence",
      "updated_at": "2026-03-25T18:29:18Z"
    },
    "readiness": {
      "blocking_issues": [],
      "last_evaluated_at": "2026-03-25T18:29:06Z",
      "pack_id": "json-health-checker-degraded-connectivity-build-pack-v1",
      "pack_kind": "build_pack",
      "readiness_state": "ready_for_deploy",
      "ready_for_deployment": true,
      "recommended_next_actions": [
        "Start with the canonical validation task in tasks/active-backlog.json.",
        "Run the inherited benchmark task after validation passes."
      ],
      "required_gates": [
        {
          "evidence_paths": [
            "eval/history/readiness-eval-json-health-checker-degraded-connectivity-build-pack-v1-validation-20260325t182852z/validation-result.json"
          ],
          "gate_id": "validate_build_pack_contract",
          "last_run_at": "2026-03-25T18:28:52Z",
          "mandatory": true,
          "status": "pass",
          "summary": "Build-pack contract validation has not been executed yet."
        },
        {
          "evidence_paths": [
            "eval/latest/index.json"
          ],
          "gate_id": "json_health_checker_template_pack_smoke_small_001",
          "last_run_at": "2026-03-25T18:29:06Z",
          "mandatory": true,
          "status": "pass",
          "summary": "Run a small deterministic JSON health-check smoke path that confirms the template exposes its manifest, readiness state, and benchmark declaration."
        }
      ],
      "schema_version": "pack-readiness/v2"
    },
    "work_state": {
      "active_task_id": null,
      "autonomy_state": "ready_for_deploy",
      "blocked_task_ids": [],
      "completed_task_ids": [
        "run_build_pack_validation",
        "run_inherited_benchmarks"
      ],
      "escalation_state": "none",
      "last_agent_action": "Completed `run_inherited_benchmarks` locally during disconnected continuity and advanced canonical state.",
      "last_outcome": "task_completed",
      "last_outcome_at": "2026-03-25T18:29:06Z",
      "last_validation_results": [
        {
          "evidence_paths": [
            "eval/history/readiness-eval-json-health-checker-degraded-connectivity-build-pack-v1-validation-20260325t182852z/validation-result.json"
          ],
          "recorded_at": "2026-03-25T18:28:52Z",
          "status": "pass",
          "summary": "Completed `run_build_pack_validation` through the declared validation_commands during a local mid-backlog checkpoint.",
          "validation_id": "run_build_pack_validation"
        },
        {
          "evidence_paths": [
            "eval/history/readiness-eval-json-health-checker-degraded-connectivity-build-pack-v1-benchmark-20260325t182906z/benchmark-result.json"
          ],
          "recorded_at": "2026-03-25T18:29:06Z",
          "status": "pass",
          "summary": "Completed `run_inherited_benchmarks` through the declared validation_commands during local active-task continuity.",
          "validation_id": "run_inherited_benchmarks"
        }
      ],
      "next_recommended_task_id": null,
      "objective_id": "json-health-checker-degraded-connectivity-build-pack-v1_objective",
      "pack_id": "json-health-checker-degraded-connectivity-build-pack-v1",
      "pending_task_ids": [],
      "resume_instructions": [
        "Read the objective, backlog, and work-state files before editing code.",
        "Inspect `.pack-state/agent-memory/latest-memory.json` first when it exists, then fall back to other `.pack-state/agent-memory/*.json` files.",
        "Run the validation task before attempting benchmark execution or deployment workflows."
      ],
      "schema_version": "work-state/v1",
      "stop_conditions": [
        "Stop when deployment or promotion becomes the next valid action under existing PackFactory workflows.",
        "Stop and escalate if the next action would require changing registry, deployment pointer, or promotion state directly."
      ]
    }
  },
  "generated_at": "2026-03-25T18:29:18Z",
  "local_disconnected_result": {
    "build_pack_id": "json-health-checker-degraded-connectivity-build-pack-v1",
    "completed_task_id": "run_inherited_benchmarks",
    "feedback_memory_path": "/home/orchadmin/project-pack-factory/build-packs/json-health-checker-degraded-connectivity-build-pack-v1/.pack-state/agent-memory/autonomy-feedback-json-health-checker-degraded-connectivity-build-pack-v1-local-disconnected-continuity-v1.json",
    "next_active_task_id": null,
    "pointer_result": {
      "build_pack_id": "json-health-checker-degraded-connectivity-build-pack-v1",
      "pointer_path": "/home/orchadmin/project-pack-factory/build-packs/json-health-checker-degraded-connectivity-build-pack-v1/.pack-state/agent-memory/latest-memory.json",
      "selected_memory_path": "/home/orchadmin/project-pack-factory/build-packs/json-health-checker-degraded-connectivity-build-pack-v1/.pack-state/agent-memory/autonomy-feedback-json-health-checker-degraded-connectivity-build-pack-v1-local-disconnected-continuity-v1.json",
      "selected_run_id": "json-health-checker-degraded-connectivity-build-pack-v1-local-disconnected-continuity-v1",
      "status": "activated"
    },
    "ready_for_deployment": true,